0,No error
1,failed to initalize Ethernet controller
2,failed to obtaiin IP from DHCP server
3,SD card communication fail. continuing with no logging to SD card
4,failed to initalize I2C bus
5,failed to initalize IO Expander 
6,failed to initalize ADC
7,error in setting time. time is from the past. time not set. continuing
8,IO expander output does not match the setting - power setting not valid
9,failed to read IO expander status - power settings not valid
10,test error reporting - NO ACTUAL ERROR
11,ADC1 readout failed - timeout
12,ADC2 readout failed - timeout
13,ADC3 readout failed - timeout
14,SD card - failed to create file
15,SD card - failed to write data
16,Time sent from master not accepted - set the clock (redundant to 7)
17,SD card not used in this measurement
18,VEML7700 light sensor not found - continue without